{
  "$schema": "https://json-schema.org/draft/2020-12/schema",
  "type": "object",
  "properties": {
    "name": { "type": "string" },
    "description": { "type": "string" },
    "rules": {
      "type": "array",
      "items": {
        "type": "object",
        "properties": {
          "parent": { "type": "string" },
          "id": { "type": "string" },
          "name": { "type": "string" },
          "description": { "type": "string" },
          "type": { "type": "string", "enum": ["global", "rule"] },
          "content": { "type": "string" }
        },
        "required": ["parent", "id", "name", "description", "type", "content"],
        "additionalProperties": false
      }
    },
    "presets": {
      "type": "object",
      "propertyNames": { "type": "string" },
      "additionalProperties": { "type": "array", "items": { "type": "string" } }
    }
  },
  "required": ["name", "description", "rules", "presets"],
  "additionalProperties": false
}
